{
  "schema_version": 2,
  "kind": "mltd-apk-builtin-manifest",
  "generated_at": "2026-10-13T00:00:00Z",
  "storage_architecture": {
    "binary_in_repo": false,
    "delivery": "apk_embedded_data_unity3d",
    "note": "These surfaces cannot be delivered by the asset-server overlay.",
    "translation_sources": "repo_text_and_images; generated_unity3d_is_a_CI_output_and_APK_release_asset"
  },
  "provenance": {
    "client_version": "9.0.300",
    "axis": "client"
  },
  "counts": {
    "surfaces": 4
  },
  "surfaces": [
    {
      "name": "bottom-bar-atlas",
      "kind": "baked-sprite-atlas",
      "target": "sharedassets1.assets:4",
      "texture": "theater_system_footer_main",
      "manifest": "manifests/bottom-bar.manifest.json",
      "slot_count": 7,
      "translation_source": {
        "relative_path": "localization/9.0.300/apk-ui-strings-zhcn.json",
        "sha256": "f624cc740bb60697bf6781402a67c89f84cc96c6c9502e1d3db05e4d93fda963",
        "bytes": 3462,
        "kind": "json-source"
      },
      "visual_sources": [
        {
          "relative_path": "localization/9.0.300/visuals/bottom-bar-off-v5.png",
          "sha256": "d3c1bbffc483437a72135f040406c074479fdd836a58c101e2646f1fc4306289",
          "bytes": 87107,
          "kind": "image-source",
          "state": "off",
          "size": [
            946,
            76
          ]
        },
        {
          "relative_path": "localization/9.0.300/visuals/bottom-bar-on-v3.png",
          "sha256": "87fc1686f6ca4d9317169c88e854cf5991f564ccb24abe4dd2cec247240585e6",
          "bytes": 113516,
          "kind": "image-source",
          "state": "on",
          "size": [
            946,
            76
          ]
        }
      ]
    },
    {
      "name": "runtime-bi",
      "kind": "encrypted-gtx-textasset",
      "target": "resources.assets:646",
      "textasset": "BI_jp.gtx",
      "records": 632,
      "unique_keys": 628,
      "source": {
        "relative_path": "data.unity3d",
        "sha256": "efff4c07236fbf59fc40bdc43442ab3d25287d5be229664cbce083622eb00230",
        "bytes": 70162422
      },
      "translation_source": {
        "relative_path": "localization/9.0.300/runtime-bi-zhcn.json",
        "kind": "json-source",
        "sha256": "c810663d0db70b805c75049440c5a6b64dfc33bb7b49497476b5462423bd88f3",
        "bytes": 259424
      }
    },
    {
      "name": "cjk-font",
      "kind": "unity-font-object",
      "target": "data.unity3d:48",
      "family": "TUDShinGoPr6-Regular",
      "sha256": "d7aed6d5196472fae27fa09aedb85887ec72d96d4999bf45ddcc5f4b40c2ec5d",
      "source_asset": "Noto Sans CJK SC"
    },
    {
      "name": "component-text",
      "kind": "source-exact-unity-ui-text",
      "target": "UI.Text.m_Text;DLText.m_Text;PictgraphText.mText",
      "records": 1729,
      "translation_source": {
        "relative_path": "localization/9.0.300/component-text-zhcn.json",
        "kind": "json-source",
        "sha256": "c4630f0c3fbd6d5f308a8529b210e90ec732df15cb09cfdce39d249125162f48",
        "bytes": 659589
      },
      "android_records": 23
    }
  ]
}
